{
  "schema": "local-seo-brain.claim-ledger.v1",
  "as_of": "2026-10-15",
  "notes": "Canonical claim dispositions. Assessment and confidence are separate; deprecated historical material remains visible only behind the generated provenance boundary.",
  "claims": [
    {
      "id": "local-ranking-factors",
      "statement": "Google publicly frames local results using relevance, distance, and prominence/popularity; these are not an exhaustive public formula.",
      "locations": [
        "README.md#Behavior and boundaries",
        "assets/template-brain/wiki/concepts/key-google-rank-factors.md#Evidence status",
        "assets/template-brain/wiki/gbp/gbp-overview.md#Evidence status",
        "references/canon/003-google-search-local-structured-ai.md#Distilled doctrine"
      ],
      "risk": "high",
      "assessment": "accepted",
      "confidence": "EVIDENCE-BASED",
      "source_ids": [
        "google-local-ranking"
      ],
      "contradicting_source_ids": [],
      "scope": "Google local results; feature and locale availability vary",
      "verified_at": "2026-10-15",
      "refresh_due": "2026-11-14",
      "owner": "evidence-lead",
      "notes": null,
      "claim_type": "policy",
      "review_result": "reviewed"
    },
    {
      "id": "local-ranking-no-public-weights",
      "statement": "Google does not publish universal weights, thresholds, or guaranteed lifts for local ranking factors.",
      "locations": [
        "assets/template-brain/wiki/concepts/key-google-rank-factors.md#Evidence status",
        "references/canon/003-google-search-local-structured-ai.md#Distilled doctrine"
      ],
      "risk": "high",
      "assessment": "accepted",
      "confidence": "EVIDENCE-BASED",
      "source_ids": [
        "google-local-ranking"
      ],
      "contradicting_source_ids": [],
      "scope": "Google local results",
      "verified_at": "2026-10-15",
      "refresh_due": "2026-11-14",
      "owner": "evidence-lead",
      "notes": null,
      "claim_type": "policy",
      "review_result": "reviewed"
    },
    {
      "id": "gbp-address-service-area",
      "statement": "A service-area business that does not serve customers at its address should remove or hide that address; storefront eligibility requires a real customer-facing location.",
      "locations": [
        "assets/template-brain/wiki/freshness/2026-gbp-changes.md#Current evidence",
        "assets/template-brain/wiki/gbp/gbp-optimization.md#Evidence status",
        "assets/template-brain/wiki/gbp/gbp-overview.md#Evidence status",
        "assets/template-brain/wiki/glossary/glossary.md#Evidence status",
        "references/canon/001-google-business-profile-representation.md#Distilled doctrine"
      ],
      "risk": "high",
      "assessment": "accepted",
      "confidence": "EVIDENCE-BASED",
      "source_ids": [
        "google-gbp-representation-guidelines",
        "google-gbp-service-areas"
      ],
      "contradicting_source_ids": [],
      "scope": "Google Business Profile; region-specific options may vary",
      "verified_at": "2026-10-15",
      "refresh_due": "2026-11-14",
      "owner": "evidence-lead",
      "notes": null,
      "claim_type": "policy",
      "review_result": "reviewed"
    },
    {
      "id": "gbp-virtual-office-coworking",
      "statement": "A rented mailing or virtual-office address where the business does not operate is ineligible; a coworking storefront requires permanent signage, customer reception, and the business's own staff during stated hours.",
      "locations": [
        "assets/template-brain/wiki/freshness/2026-gbp-changes.md#Current evidence",
        "assets/template-brain/wiki/gbp/gbp-optimization.md#Evidence status",
        "assets/template-brain/wiki/gbp/gbp-overview.md#Evidence status",
        "references/canon/001-google-business-profile-representation.md#Distilled doctrine"
      ],
      "risk": "high",
      "assessment": "accepted",
      "confidence": "EVIDENCE-BASED",
      "source_ids": [
        "google-gbp-representation-guidelines"
      ],
      "contradicting_source_ids": [],
      "scope": "Google Business Profile eligibility",
      "verified_at": "2026-10-15",
      "refresh_due": "2026-11-14",
      "owner": "evidence-lead",
      "notes": null,
      "claim_type": "policy",
      "review_result": "reviewed"
    },
    {
      "id": "gbp-name-and-categories",
      "statement": "A Business Profile should use the real-world name and the fewest accurate categories needed to describe its core business; fixed category quotas are not official doctrine.",
      "locations": [
        "assets/template-brain/wiki/freshness/2026-gbp-changes.md#Current evidence",
        "assets/template-brain/wiki/gbp/gbp-categories-edge-cases-re-theming.md#Evidence status",
        "assets/template-brain/wiki/gbp/gbp-categories.md#Evidence status",
        "assets/template-brain/wiki/prompts/gbp-categories-prompt.md#Evidence status",
        "assets/template-brain/wiki/prompts/gbp-description-claude-prompt-2.md#Evidence status",
        "assets/svg/three-phases-of-local-seo.svg",
        "references/canon/001-google-business-profile-representation.md#Distilled doctrine"
      ],
      "risk": "high",
      "assessment": "accepted",
      "confidence": "EVIDENCE-BASED",
      "source_ids": [
        "google-gbp-representation-guidelines",
        "google-gbp-categories"
      ],
      "contradicting_source_ids": [],
      "scope": "Google Business Profile",
      "verified_at": "2026-10-15",
      "refresh_due": "2026-11-14",
      "owner": "evidence-lead",
      "notes": null,
      "claim_type": "policy",
      "review_result": "reviewed"
    },
    {
      "id": "gbp-verification-authenticity",
      "statement": "Verification evidence must truthfully demonstrate business location, existence, and management. Video verification must be captured live, unique and unedited, and exclude sensitive information and other people’s faces.",
      "locations": [
        "assets/template-brain/wiki/freshness/2026-gbp-changes.md#Current evidence",
        "assets/template-brain/wiki/gbp/gbp-verification.md#Evidence status",
        "assets/template-brain/wiki/gbp/warning-for-gbp-changes.md#Evidence status",
        "assets/template-brain/wiki/prompts/gbp-categories-prompt.md#Evidence status",
        "assets/svg/three-phases-of-local-seo.svg",
        "references/canon/001-google-business-profile-representation.md#Distilled doctrine"
      ],
      "risk": "high",
      "assessment": "accepted",
      "confidence": "EVIDENCE-BASED",
      "source_ids": [
        "google-gbp-verification",
        "google-gbp-video-verification"
      ],
      "contradicting_source_ids": [],
      "scope": "Google Business Profile verification",
      "verified_at": "2026-10-15",
      "refresh_due": "2026-11-14",
      "owner": "evidence-lead",
      "notes": null,
      "claim_type": "policy",
      "review_result": "reworded"
    },
    {
      "id": "review-manipulation-prohibited",
      "statement": "Google Maps and Business Profile reviews prohibit incentives for posting, revising, or removing reviews, even when disclosed. Fake, gated, quota-driven, conflict-of-interest, selectively positive, or wording-manipulated reviews are prohibited.",
      "locations": [
        "SKILL.md#Operating contract",
        "assets/template-brain/wiki/freshness/2026-gbp-changes.md#Current evidence",
        "assets/template-brain/wiki/prompts/reddit-claude-prompt.md#Evidence status",
        "assets/svg/three-phases-of-local-seo.svg"
      ],
      "risk": "high",
      "assessment": "accepted",
      "confidence": "EVIDENCE-BASED",
      "source_ids": [
        "google-maps-prohibited-content",
        "google-maps-ugc-policy",
        "google-gbp-get-reviews"
      ],
      "contradicting_source_ids": [],
      "scope": "Google Maps and Business Profile contributions",
      "verified_at": "2026-10-15",
      "refresh_due": "2026-11-14",
      "owner": "evidence-lead",
      "notes": null,
      "claim_type": "policy",
      "review_result": "reworded"
    },
    {
      "id": "truthful-firsthand-content",
      "statement": "Prompts and workflows must not fabricate firsthand experiences, identities, costs, awards, guarantees, reviews, or community posts.",
      "locations": [
        "references/safety-gates.md",
        "assets/template-brain/wiki/freshness/2026-reddit-llm-citation-engine.md#Current evidence",
        "assets/template-brain/wiki/content/content-blog-post-writing.md#Evidence status",
        "assets/template-brain/wiki/prompts/ai-detector-test-follow-up-prompt.md#Evidence status",
        "assets/template-brain/wiki/prompts/ai-homepage-rewrite-prompt.md#Evidence status",
        "assets/template-brain/wiki/prompts/ai-supporting-pages-rewrite-prompt.md#Evidence status",
        "assets/template-brain/wiki/prompts/backlink-competition-prompt.md#Evidence status",
        "assets/template-brain/wiki/prompts/blog-post-outline-prompt.md#Evidence status",
        "assets/template-brain/wiki/prompts/blog-post-writing-prompt.md#Evidence status",
        "assets/template-brain/wiki/prompts/claude-deep-research-prompt.md#Evidence status",
        "assets/template-brain/wiki/prompts/claude-prompt-1.md#Evidence status",
        "assets/template-brain/wiki/prompts/claude-prompt-2.md#Evidence status",
        "assets/template-brain/wiki/prompts/content-planning-for-topical-relevance-prompt.md#Evidence status",
        "assets/template-brain/wiki/prompts/content-prioritization-prompt.md#Evidence status",
        "assets/template-brain/wiki/prompts/ctr-audit-prompt.md#Evidence status",
        "assets/template-brain/wiki/prompts/follow-up-prompt-1.md#Evidence status",
        "assets/template-brain/wiki/prompts/follow-up-prompt-2.md#Evidence status",
        "assets/template-brain/wiki/prompts/follow-up-prompt.md#Evidence status",